{
  "$schema": "https://sourcegit-scm.github.io/sourcegit-theme.schema.json",
  "Version": "1.0",
  "Name": "Solarized Dark Bordered",
  "Author": "Ethan Schoonover",
  "Url": "https://ethanschoonover.com/solarized/",
  "BasicColors": {
    "Window": "#002b36",
    "WindowBorder": "#002b36",
    "TitleBar": "#073642",
    "ToolBar": "#002b36",
    "Popup": "#073642",
    "PopupBorder": "#3a5a64",
    "Contents": "#073642",
    "HistoryBG": "#01303c",
    "Badge": "#268bd2",
    "BadgeFG": "#fdf6e3",
    "Conflict": "#5c3928",
    "Conflict.Foreground": "#dc322f",
    "Border0": "#204f5f",
    "Border1": "#25596a",
    "Border2": "#204f5f",
    "FlatButton.Background": "#073642",
    "FlatButton.BackgroundHovered": "#0b3d49",
    "FlatButton.FloatingBorder": "#25596a",
    "FG1": "#93a1a1",
    "FG2": "#839496",
    "Diff.EmptyBG": "#002b36",
    "Diff.AddedBG": "#173f35",
    "Diff.DeletedBG": "#4b2c2c",
    "Diff.AddedHighlight": "#235444",
    "Diff.DeletedHighlight": "#653636",
    "SystemAccentColor": "#268bd2",
    "Link": "#268bd2",
    "InlineCode": "#30ffffff",
    "InlineCodeFG": "#d7ba7d"
  },
  "GraphPenThickness": 2,
  "OpacityForNotMergedCommits": 0.4,
  "GraphColors": [
    "#268bd2",
    "#2aa198",
    "#859900",
    "#b58900",
    "#cb4b16",
    "#d33682"
  ]
}
