{
  "$schema": "https://sourcegit-scm.github.io/sourcegit-theme.schema.json",
  "Version": "1.0",
  "Name": "Solarized Light Bordered",
  "Author": "Ethan Schoonover",
  "Url": "https://ethanschoonover.com/solarized/",
  "BasicColors": {
    "Window": "#fdf6e3",
    "WindowBorder": "#fdf6e3",
    "TitleBar": "#eee8d5",
    "ToolBar": "#fdf6e3",
    "Popup": "#fdf6e3",
    "PopupBorder": "#fefcf7",
    "Contents": "#eee8d5",
    "HistoryBG": "#faf3e0",
    "Badge": "#268bd2",
    "BadgeFG": "#fdf6e3",
    "Conflict": "#f7d8c4",
    "Conflict.Foreground": "#dc322f",
    "Border0": "#ddd8c7",
    "Border1": "#c6c2b4",
    "Border2": "#ddd8c7",
    "FlatButton.Background": "#fdf6e3",
    "FlatButton.BackgroundHovered": "#eee8d5",
    "FlatButton.FloatingBorder": "#ffffff",
    "FG1": "#586e75",
    "FG2": "#657b83",
    "Diff.EmptyBG": "#eee8d5",
    "Diff.AddedBG": "#e0ead6",
    "Diff.DeletedBG": "#f3d6c8",
    "Diff.AddedHighlight": "#cbdcab",
    "Diff.DeletedHighlight": "#eeb9a6",
    "SystemAccentColor": "#268bd2",
    "Link": "#268bd2",
    "InlineCode": "#d1cbba",
    "InlineCodeFG": "#cf8806"
  },
  "GraphPenThickness": 2,
  "OpacityForNotMergedCommits": 0.4,
  "GraphColors": [
    "#268bd2",
    "#2aa198",
    "#859900",
    "#b58900",
    "#cb4b16",
    "#d33682"
  ]
}
