{
  "BasicColors": {
    "Window": "#f0f3f4",
    "WindowBorder": "#f0f3f4",
    "TitleBar": "#e2e6e8",
    "ToolBar": "#f0f3f4",
    "Popup": "#f0f3f4",
    "PopupBorder": "#e2e6e8",
    "Contents": "#f0f3f4",
    "HistoryBG": "#f0f3f4",
    "Badge": "#0ad6ff",
    "BadgeFG": "#1e2029",
    "Conflict": "#fb5b66",
    "Conflict.Foreground": "#1e2029",
    "Conflict.MineBG": "#cbf5e3",
    "Conflict.TheirsBG": "#d2d9ef",
    "Border0": "#e2e6e8",
    "Border1": "#d5d9db",
    "Border2": "#e2e6e8",
    "FlatButton.Background": "#e2e6e8",
    "FlatButton.BackgroundHovered": "#d5d9db",
    "FlatButton.FloatingBorder": "#fb5bb6",
    "FG1": "#1e2029",
    "FG2": "#5b73dc",
    "Diff.EmptyBG": "#f0f3f4",
    "Diff.AddedBG": "#cbf5e3",
    "Diff.DeletedBG": "#f2d4d7",
    "Diff.AddedHighlight": "#a6f7d2",
    "Diff.DeletedHighlight": "#f4b6bb",
    "Link": "#0ad6ff",
    "Diff.BlockBorderHighlight": "#fb5bb6",
    "SystemAccentColor": "#fb5bb6",
    "InlineCode": "#d5d9db",
    "InlineCodeFG": "#1e2029"
  },
  "GraphPenThickness": 2,
  "OpacityForNotMergedCommits": 0.5,
  "GraphColors": [
    "#fb5bb6",
    "#0ad6ff",
    "#8a69f7",
    "#fb5b66",
    "#ffaf4d",
    "#fff952"
  ]
}
