{
  "$schema": "https://sourcegit-scm.github.io/sourcegit-theme.schema.json",
  "Version": "1.0",
  "Name": "JetBrains Dark Diff High Contrast",
  "Author": "@MelonHell",
  "Url": "https://gist.github.com/MelonHell",
  "BasicColors": {
    "Window": "#2b2d30",
    "WindowBorder": "#2b2d30",
    "TitleBar": "#222426",
    "ToolBar": "#2b2d30",
    "Popup": "#2b2d30",
    "Contents": "#1e1f22",
    "HistoryBG": "#2b2d30",
    "Badge": "#3574f0",
    "BadgeFG": "#ffffff",
    "Conflict": "#45302b",
    "Conflict.Foreground": "#ced0d6",
    "Border0": "#1e1f22",
    "Border1": "#4e5157",
    "Border2": "#4e5157",
    "FlatButton.Background": "#2b2d30",
    "FlatButton.BackgroundHovered": "#393b40",
    "FG1": "#ced0d6",
    "FG2": "#808080",
    "Diff.EmptyBG": "#101010",
    "Diff.AddedBG": "#1c322b",
    "Diff.DeletedBG": "#412323",
    "Diff.AddedHighlight": "#265444",
    "Diff.DeletedHighlight": "#883838"
  },
  "GraphPenThickness": 2,
  "GraphColors": [
    "#FF15A0BF",
    "#FF0669F7",
    "#FF8E00C2",
    "#FFC517B6",
    "#FFD90171",
    "#FFCD0101",
    "#FFF25D2E",
    "#FFF2CA33",
    "#FF7BD938",
    "#FF2ECE9D"
  ]
}