{
  "$schema": "https://sourcegit-scm.github.io/sourcegit-theme.schema.json",
  "Version": "1.0",
  "Name": "Eldritch Cthulhu",
  "Author": "@eldritch-theme",
  "Url": "https://github.com/eldritch-theme",
  "BasicColors": {
    "Window": "#212337",
    "WindowBorder": "#212337",
    "TitleBar": "#323449",
    "ToolBar": "#212337",
    "Popup": "#5b5c66",
    "PopupBorder": "#323449",
    "Contents": "#212337",
    "HistoryBG": "#212337",
    "Badge": "#f16c75",
    "BadgeFG": "#ebfafa",
    "Conflict": "#f16c75",
    "Conflict.Foreground": "#ebfafa",
    "Conflict.MineBG": "#254c4a",
    "Conflict.TheirsBG": "#303555",
    "Border0": "#323449",
    "Border1": "#454759",
    "Border2": "#323449",
    "FlatButton.Background": "#323449",
    "FlatButton.BackgroundHovered": "#454759",
    "FlatButton.FloatingBorder": "#37f499",
    "FG1": "#ebfafa",
    "FG2": "#7081d0",
    "Diff.EmptyBG": "#212337",
    "Diff.AddedBG": "#254c4a",
    "Diff.DeletedBG": "#4a3143",
    "Diff.AddedHighlight": "#29765e",
    "Diff.DeletedHighlight": "#74404f",
    "Diff.BlockBorderHighlight": "#37f499",
    "SystemAccentColor": "#37f499",
    "Link": "#04d1f9",
    "InlineCode": "#454759",
    "InlineCodeFG": "#ebfafa"
  },
  "GraphPenThickness": 2,
  "OpacityForNotMergedCommits": 0.5,
  "GraphColors": [
    "#f16c75",
    "#f7c67f",
    "#f1fc79",
    "#37f499",
    "#04d1f9",
    "#f265b5",
    "#a48cf2",
    "#7081d0"
  ]
}